Key;Item Type;Publication Year;Author;Title;Publication Title;ISBN;ISSN;DOI;Url;Abstract Note;Date;Date Added;Date Modified;Access Date;Pages;Num Pages;Issue;Volume;Number Of Volumes;Journal Abbreviation;Short Title;Series;Series Number;Series Text;Series Title;Publisher;Place;Language;Rights;Type;Archive;Archive Location;Library Catalog;Call Number
464NTDL3;journalArticle;1993;"Belogurov, A. A.; Delver, E. P.; Rodzevich, O. V.";Plasmid pKM101 encodes two nonhomologous antirestriction proteins (ArdA and ArdB) whose expression is controlled by homologous regulatory sequences;Journal of Bacteriology;;0021-9193;10.1128/jb.175.15.4843-4850.1993;;The IncN plasmid pKM101 (a derivative of R46) encodes the antirestriction protein ArdB (alleviation of restriction of DNA) in addition to another antirestriction protein, ArdA, described previously. The relevant gene, ardB, was located in the leading region of pKM101, about 7 kb from oriT. The nucleotide sequence of ardB was determined, and an appropriate polypeptide was identified in maxicells of Escherichia coli. Like ArdA, ArdB efficiently inhibits restriction by members of the three known families of type I systems of E. coli and only slightly affects the type II enzyme, EcoRI. However, in contrast to ArdA, ArdB is ineffective against the modification activity of the type I (EcoK) system. Comparison of deduced amino acid sequences of ArdA and ArdB revealed only one small region of similarity (nine residues), suggesting that this region may be somehow involved in the interaction with the type I restriction systems. We also found that the expression of both ardA and ardB genes is controlled jointly by two pKM101-encoded proteins, ArdK and ArdR, with molecular weights of about 15,000 and 20,000, respectively. The finding that the sequences immediately upstream of ardA and ardB share about 94% identity over 218 bp suggests that their expression may be controlled by ArdK and ArdR at the transcriptional level. Deletion studies and promoter probe analysis of these sequences revealed the regions responsible for the action of ArdK and ArdR as regulatory proteins. We propose that both types of antirestriction proteins may play a pivotal role in overcoming the host restriction barrier by self-transmissible broad-host-range plasmids. It seems likely that the ardKR-dependent regulatory system serves in this case as a genetic switch that controls the expression of plasmid-encoded antirestriction functions during mating.;1993-08;05/08/2024 15:31;05/08/2024 15:31;;4843-4850;;15;175;;J Bacteriol;;;;;;;;eng;;;;;PubMed;
FKV35WDF;journalArticle;2024;"Yan, Yuchen; Zheng, Jinfang; Zhang, Xinpeng; Yin, Yanbin";dbAPIS: a database of anti-prokaryotic immune system genes;Nucleic Acids Research;;0305-1048;10.1093/nar/gkad932;https://doi.org/10.1093/nar/gkad932;"Anti-prokaryotic immune system (APIS) proteins, typically encoded by phages, prophages, and plasmids, inhibit prokaryotic immune systems (e.g. restriction modification, toxin-antitoxin, CRISPR-Cas). A growing number of APIS genes have been characterized and dispersed in the literature. Here we developed dbAPIS (https://bcb.unl.edu/dbAPIS), as the first literature curated data repository for experimentally verified APIS genes and their associated protein families. The key features of dbAPIS include: (i) experimentally verified APIS genes with their protein sequences, functional annotation, PDB or AlphaFold predicted structures, genomic context, sequence and structural homologs from different microbiome/virome databases; (ii) classification of APIS proteins into sequence-based families and construction of hidden Markov models (HMMs); (iii) user-friendly web interface for data browsing by the inhibited immune system types or by the hosts, and functions for searching and batch downloading of pre-computed data; (iv) Inclusion of all types of APIS proteins (except for anti-CRISPRs) that inhibit a variety of prokaryotic defense systems (e.g. RM, TA, CBASS, Thoeris, Gabija). The current release of dbAPIS contains 41 verified APIS proteins and ∼4400 sequence homologs of 92 families and 38 clans. dbAPIS will facilitate the discovery of novel anti-defense genes and genomic islands in phages, by providing a user-friendly data repository and a web resource for an easy homology search against known APIS proteins.";05/01/2024;05/08/2024 15:31;05/08/2024 15:31;05/08/2024 15:31;D419-D425;;D1;52;;Nucleic Acids Research;dbAPIS;;;;;;;;;;;;Silverchair;
5H8UVF82;journalArticle;2019;"Mirdita, Milot; Steinegger, Martin; Söding, Johannes";MMseqs2 desktop and local web server app for fast, interactive sequence searches;Bioinformatics (Oxford, England);;1367-4811;10.1093/bioinformatics/bty1057;;SUMMARY: The MMseqs2 desktop and web server app facilitates interactive sequence searches through custom protein sequence and profile databases on personal workstations. By eliminating MMseqs2's runtime overhead, we reduced response times to a few seconds at sensitivities close to BLAST. AVAILABILITY AND IMPLEMENTATION: The app is easy to install for non-experts. GPLv3-licensed code, pre-built desktop app packages for Windows, MacOS and Linux, Docker images for the web server application and a demo web server are available at https://search.mmseqs.com. SUPPLEMENTARY INFORMATION: Supplementary data are available at Bioinformatics online.;15/08/2019;05/08/2024 15:32;05/08/2024 15:32;;2856-2858;;16;35;;Bioinformatics;;;;;;;;eng;;;;;PubMed;
PG3HIIG5;journalArticle;2013;"Katoh, Kazutaka; Standley, Daron M.";MAFFT Multiple Sequence Alignment Software Version 7: Improvements in Performance and Usability;Molecular Biology and Evolution;;0737-4038;10.1093/molbev/mst010;https://www.ncbi.nlm.nih.gov/pmc/articles/PMC3603318/;We report a major update of the MAFFT multiple sequence alignment program. This version has several new features, including options for adding unaligned sequences into an existing alignment, adjustment of direction in nucleotide alignment, constrained alignment and parallel processing, which were implemented after the previous major update. This report shows actual examples to explain how these features work, alone and in combination. Some examples incorrectly aligned by MAFFT are also shown to clarify its limitations. We discuss how to avoid misalignments, and our ongoing efforts to overcome such limitations.;2013-04;05/08/2024 15:32;05/08/2024 15:32;05/08/2024 15:32;772-780;;4;30;;Mol Biol Evol;MAFFT Multiple Sequence Alignment Software Version 7;;;;;;;;;;;;PubMed Central;
2YXWKUBS;journalArticle;2011;Eddy, Sean R.;Accelerated Profile HMM Searches;PLOS Computational Biology;;1553-7358;10.1371/journal.pcbi.1002195;https://journals.plos.org/ploscompbiol/article?id=10.1371/journal.pcbi.1002195;Profile hidden Markov models (profile HMMs) and probabilistic inference methods have made important contributions to the theory of sequence database homology search. However, practical use of profile HMM methods has been hindered by the computational expense of existing software implementations. Here I describe an acceleration heuristic for profile HMMs, the “multiple segment Viterbi” (MSV) algorithm. The MSV algorithm computes an optimal sum of multiple ungapped local alignment segments using a striped vector-parallel approach previously described for fast Smith/Waterman alignment. MSV scores follow the same statistical distribution as gapped optimal local alignment scores, allowing rapid evaluation of significance of an MSV score and thus facilitating its use as a heuristic filter. I also describe a 20-fold acceleration of the standard profile HMM Forward/Backward algorithms using a method I call “sparse rescaling”. These methods are assembled in a pipeline in which high-scoring MSV hits are passed on for reanalysis with the full HMM Forward/Backward algorithm. This accelerated pipeline is implemented in the freely available HMMER3 software package. Performance benchmarks show that the use of the heuristic MSV filter sacrifices negligible sensitivity compared to unaccelerated profile HMM searches. HMMER3 is substantially more sensitive and 100- to 1000-fold faster than HMMER2. HMMER3 is now about as fast as BLAST for protein searches.;20/10/2011;05/08/2024 15:32;05/08/2024 15:32;05/08/2024 15:32;e1002195;;10;7;;PLOS Computational Biology;;;;;;;;en;;;;;PLoS Journals;
VXGTUP9B;journalArticle;2021;"Guo, Jiarong; Bolduc, Ben; Zayed, Ahmed A.; Varsani, Arvind; Dominguez-Huerta, Guillermo; Delmont, Tom O.; Pratama, Akbar Adjie; Gazitúa, M. Consuelo; Vik, Dean; Sullivan, Matthew B.; Roux, Simon";VirSorter2: a multi-classifier, expert-guided approach to detect diverse DNA and RNA viruses;Microbiome;;2049-2618;10.1186/s40168-020-00990-y;https://doi.org/10.1186/s40168-020-00990-y;Viruses are a significant player in many biosphere and human ecosystems, but most signals remain “hidden” in metagenomic/metatranscriptomic sequence datasets due to the lack of universal gene markers, database representatives, and insufficiently advanced identification tools.;01/02/2021;05/08/2024 15:32;05/08/2024 15:32;05/08/2024 15:32;37;;1;9;;Microbiome;VirSorter2;;;;;;;;;;;;BioMed Central;
QXIM5ZZ4;journalArticle;2022;"Néron, Bertrand; Littner, Eloi; Haudiquet, Matthieu; Perrin, Amandine; Cury, Jean; Rocha, Eduardo P. C.";IntegronFinder 2.0: Identification and Analysis of Integrons across Bacteria, with a Focus on Antibiotic Resistance in Klebsiella;Microorganisms;;2076-2607;10.3390/microorganisms10040700;;Integrons are flexible gene-exchanging platforms that contain multiple cassettes encoding accessory genes whose order is shuffled by a specific integrase. Integrons embedded within mobile genetic elements often contain multiple antibiotic resistance genes that they spread among nosocomial pathogens and contribute to the current antibiotic resistance crisis. However, most integrons are presumably sedentary and encode a much broader diversity of functions. IntegronFinder is a widely used software to identify novel integrons in bacterial genomes, but has aged and lacks some useful functionalities to handle very large datasets of draft genomes or metagenomes. Here, we present IntegronFinder version 2. We have updated the code, improved its efficiency and usability, adapted the output to incomplete genome data, and added a few novel functions. We describe these changes and illustrate the relevance of the program by analyzing the distribution of integrons across more than 20,000 fully sequenced genomes. We also take full advantage of its novel capabilities to analyze close to 4000 Klebsiella pneumoniae genomes for the presence of integrons and antibiotic resistance genes within them. Our data show that K. pneumoniae has a large diversity of integrons and the largest mobile integron in our database of plasmids. The pangenome of these integrons contains a total of 165 different gene families with most of the largest families being related with resistance to numerous types of antibiotics. IntegronFinder is a free and open-source software available on multiple public platforms.;24/03/2022;05/08/2024 15:33;05/08/2024 15:33;;700;;4;10;;Microorganisms;IntegronFinder 2.0;;;;;;;eng;;;;;PubMed;
5CISBKND;journalArticle;2020;"Cury, Jean; Abby, Sophie S.; Doppelt-Azeroual, Olivia; Néron, Bertrand; Rocha, Eduardo P. C.";Identifying Conjugative Plasmids and Integrative Conjugative Elements with CONJscan;Methods in Molecular Biology (Clifton, N.J.);;1940-6029;10.1007/978-1-4939-9877-7_19;;We present a computational method to identify conjugative systems in plasmids and chromosomes using the CONJscan module of MacSyFinder. The method relies on the identification of the protein components of the system using hidden Markov model profiles and then checking that the composition and genetic organization of the system is consistent with that expected from a conjugative system. The method can be assessed online using the Galaxy workflow or locally using a standalone software. The latter version allows to modify the models of the module (i.e., to change the expected components, their number, and their organization).CONJscan identifies conjugative systems, but when the mobile genetic element is integrative (ICE), one often also wants to delimit it from the chromosome. We present a method, with a script, to use the results of CONJscan and comparative genomics to delimit ICE in chromosomes. The method provides a visual representation of the ICE location. Together, these methods facilitate the identification of conjugative elements in bacterial genomes.;2020;05/08/2024 15:33;05/08/2024 15:33;;265-283;;;2075;;Methods Mol Biol;;;;;;;;eng;;;;;PubMed;
4C2R3MIP;journalArticle;2021;"Mistry, Jaina; Chuguransky, Sara; Williams, Lowri; Qureshi, Matloob; Salazar, Gustavo A.; Sonnhammer, Erik L. L.; Tosatto, Silvio C. E.; Paladin, Lisanna; Raj, Shriya; Richardson, Lorna J.; Finn, Robert D.; Bateman, Alex";Pfam: The protein families database in 2021;Nucleic Acids Research;;1362-4962;10.1093/nar/gkaa913;;The Pfam database is a widely used resource for classifying protein sequences into families and domains. Since Pfam was last described in this journal, over 350 new families have been added in Pfam 33.1 and numerous improvements have been made to existing entries. To facilitate research on COVID-19, we have revised the Pfam entries that cover the SARS-CoV-2 proteome, and built new entries for regions that were not covered by Pfam. We have reintroduced Pfam-B which provides an automatically generated supplement to Pfam and contains 136 730 novel clusters of sequences that are not yet matched by a Pfam family. The new Pfam-B is based on a clustering by the MMseqs2 software. We have compared all of the regions in the RepeatsDB to those in Pfam and have started to use the results to build and refine Pfam repeat families. Pfam is freely available for browsing and download at http://pfam.xfam.org/.;08/01/2021;05/08/2024 15:33;05/08/2024 15:33;;D412-D419;;D1;49;;Nucleic Acids Res;Pfam;;;;;;;eng;;;;;PubMed;
M7M6WS76;journalArticle;2004;Edgar, Robert C.;MUSCLE: multiple sequence alignment with high accuracy and high throughput;Nucleic Acids Research;;1362-4962;10.1093/nar/gkh340;;We describe MUSCLE, a new computer program for creating multiple alignments of protein sequences. Elements of the algorithm include fast distance estimation using kmer counting, progressive alignment using a new profile function we call the log-expectation score, and refinement using tree-dependent restricted partitioning. The speed and accuracy of MUSCLE are compared with T-Coffee, MAFFT and CLUSTALW on four test sets of reference alignments: BAliBASE, SABmark, SMART and a new benchmark, PREFAB. MUSCLE achieves the highest, or joint highest, rank in accuracy on each of these sets. Without refinement, MUSCLE achieves average accuracy statistically indistinguishable from T-Coffee and MAFFT, and is the fastest of the tested methods for large numbers of sequences, aligning 5000 sequences of average length 350 in 7 min on a current desktop computer. The MUSCLE program, source code and PREFAB test data are freely available at http://www.drive5. com/muscle.;2004;05/08/2024 15:33;05/08/2024 15:33;;1792-1797;;5;32;;Nucleic Acids Res;MUSCLE;;;;;;;eng;;;;;PubMed;
T3ECQKMH;journalArticle;2020;"Steenwyk, Jacob L.; Iii, Thomas J. Buida; Li, Yuanning; Shen, Xing-Xing; Rokas, Antonis";ClipKIT: A multiple sequence alignment trimming software for accurate phylogenomic inference;PLOS Biology;;1545-7885;10.1371/journal.pbio.3001007;https://journals.plos.org/plosbiology/article?id=10.1371/journal.pbio.3001007;Highly divergent sites in multiple sequence alignments (MSAs), which can stem from erroneous inference of homology and saturation of substitutions, are thought to negatively impact phylogenetic inference. Thus, several different trimming strategies have been developed for identifying and removing these sites prior to phylogenetic inference. However, a recent study reported that doing so can worsen inference, underscoring the need for alternative alignment trimming strategies. Here, we introduce ClipKIT, an alignment trimming software that, rather than identifying and removing putatively phylogenetically uninformative sites, instead aims to identify and retain parsimony-informative sites, which are known to be phylogenetically informative. To test the efficacy of ClipKIT, we examined the accuracy and support of phylogenies inferred from 14 different alignment trimming strategies, including those implemented in ClipKIT, across nearly 140,000 alignments from a broad sampling of evolutionary histories. Phylogenies inferred from ClipKIT-trimmed alignments are accurate, robust, and time saving. Furthermore, ClipKIT consistently outperformed other trimming methods across diverse datasets, suggesting that strategies based on identifying and retaining parsimony-informative sites provide a robust framework for alignment trimming.;02/12/2020;05/08/2024 15:33;05/08/2024 15:33;05/08/2024 15:33;e3001007;;12;18;;PLOS Biology;ClipKIT;;;;;;;en;;;;;PLoS Journals;
UDXS5GVU;journalArticle;2015;"Nguyen, Lam-Tung; Schmidt, Heiko A.; von Haeseler, Arndt; Minh, Bui Quang";IQ-TREE: A Fast and Effective Stochastic Algorithm for Estimating Maximum-Likelihood Phylogenies;Molecular Biology and Evolution;;0737-4038;10.1093/molbev/msu300;https://doi.org/10.1093/molbev/msu300;Large phylogenomics data sets require fast tree inference methods, especially for maximum-likelihood (ML) phylogenies. Fast programs exist, but due to inherent heuristics to find optimal trees, it is not clear whether the best tree is found. Thus, there is need for additional approaches that employ different search strategies to find ML trees and that are at the same time as fast as currently available ML programs. We show that a combination of hill-climbing approaches and a stochastic perturbation method can be time-efficiently implemented. If we allow the same CPU time as RAxML and PhyML, then our software IQ-TREE found higher likelihoods between 62.2% and 87.1% of the studied alignments, thus efficiently exploring the tree-space. If we use the IQ-TREE stopping rule, RAxML and PhyML are faster in 75.7% and 47.1% of the DNA alignments and 42.2% and 100% of the protein alignments, respectively. However, the range of obtaining higher likelihoods with IQ-TREE improves to 73.3–97.1%. IQ-TREE is freely available at http://www.cibiv.at/software/iqtree.;01/01/2015;05/08/2024 15:34;05/08/2024 15:34;05/08/2024 15:34;268-274;;1;32;;Molecular Biology and Evolution;IQ-TREE;;;;;;;;;;;;Silverchair;
4IIRBCFW;journalArticle;2022;"Mirdita, Milot; Schütze, Konstantin; Moriwaki, Yoshitaka; Heo, Lim; Ovchinnikov, Sergey; Steinegger, Martin";ColabFold: making protein folding accessible to all;Nature Methods;;1548-7105;10.1038/s41592-022-01488-1;https://www.nature.com/articles/s41592-022-01488-1;ColabFold offers accelerated prediction of protein structures and complexes by combining the fast homology search of MMseqs2 with AlphaFold2 or RoseTTAFold. ColabFold’s 40−60-fold faster search and optimized model utilization enables prediction of close to 1,000 structures per day on a server with one graphics processing unit. Coupled with Google Colaboratory, ColabFold becomes a free and accessible platform for protein folding. ColabFold is open-source software available at https://github.com/sokrypton/ColabFoldand its novel environmental databases are available at https://colabfold.mmseqs.com.;2022-06;05/08/2024 15:34;05/08/2024 15:34;05/08/2024 15:34;679-682;;6;19;;Nat Methods;ColabFold;;;;;;;en;2022 The Author(s);;;;www.nature.com;
KTR5ZDNB;journalArticle;2014;"Pawluk, April; Bondy-Denomy, Joseph; Cheung, Vivian H. W.; Maxwell, Karen L.; Davidson, Alan R.";A new group of phage anti-CRISPR genes inhibits the type I-E CRISPR-Cas system of Pseudomonas aeruginosa;mBio;;2150-7511;10.1128/mBio.00896-14;;CRISPR-Cas systems are one of the most widespread phage resistance mechanisms in prokaryotes. Our lab recently identified the first examples of phage-borne anti-CRISPR genes that encode protein inhibitors of the type I-F CRISPR-Cas system of Pseudomonas aeruginosa. A key question arising from this work was whether there are other types of anti-CRISPR genes. In the current work, we address this question by demonstrating that some of the same phages carrying type I-F anti-CRISPR genes also possess genes that mediate inhibition of the type I-E CRISPR-Cas system of P. aeruginosa. We have discovered four distinct families of these type I-E anti-CRISPR genes. These genes do not inhibit the type I-F CRISPR-Cas system of P. aeruginosa or the type I-E system of Escherichia coli. Type I-E and I-F anti-CRISPR genes are located at the same position in the genomes of a large group of related P. aeruginosa phages, yet they are found in a variety of combinations and arrangements. We have also identified functional anti-CRISPR genes within nonprophage Pseudomonas genomic regions that are likely mobile genetic elements. This work emphasizes the potential importance of anti-CRISPR genes in phage evolution and lateral gene transfer and supports the hypothesis that more undiscovered families of anti-CRISPR genes exist. Finally, we provide the first demonstration that the type I-E CRISPR-Cas system of P. aeruginosa is naturally active without genetic manipulation, which contrasts with E. coli and other previously characterized I-E systems. IMPORTANCE The CRISPR-Cas system is an adaptive immune system possessed by the majority of prokaryotic organisms to combat potentially harmful foreign genetic elements. This study reports the discovery of bacteriophage-encoded anti-CRISPR genes that mediate inhibition of a well-studied subtype of CRISPR-Cas system. The four families of anti-CRISPR genes described here, which comprise only the second group of anti-CRISPR genes to be identified, encode small proteins that bear no sequence similarity to previously studied phage or bacterial proteins. Anti-CRISPR genes represent a newly discovered and intriguing facet of the ongoing evolutionary competition between phages and their bacterial hosts.;15/04/2014;05/08/2024 15:34;05/08/2024 15:34;;e00896;;2;5;;mBio;;;;;;;;eng;;;;;PubMed;
YG9S4JJI;journalArticle;2005;"Tock, Mark R.; Dryden, David T. F.";The biology of restriction and anti-restriction;Current Opinion in Microbiology;;1369-5274;10.1016/j.mib.2005.06.003;;The phenomena of prokaryotic restriction and modification, as well as anti-restriction, were first discovered five decades ago but have yielded only gradually to rigorous analysis. Work presented at the 5th New England Biolabs Meeting on Restriction-Modification (available on REBASE, http://www.rebase.com) and several recently published genetic, biochemical and biophysical analyses indicate that these fields continue to contribute significantly to basic science. Recently, there have been several studies that have shed light on the still developing field of restriction-modification and on the newly re-emerging field of anti-restriction.;2005-08;05/08/2024 15:34;05/08/2024 15:34;;466-472;;4;8;;Curr Opin Microbiol;;;;;;;;eng;;;;;PubMed;
Y6UQ8P76;journalArticle;2018;"Hille, Frank; Richter, Hagen; Wong, Shi Pey; Bratovič, Majda; Ressel, Sarah; Charpentier, Emmanuelle";The Biology of CRISPR-Cas: Backward and Forward;Cell;;1097-4172;10.1016/j.cell.2017.11.032;;In bacteria and archaea, clustered regularly interspaced short palindromic repeats (CRISPR) and CRISPR-associated (Cas) proteins constitute an adaptive immune system against phages and other foreign genetic elements. Here, we review the biology of the diverse CRISPR-Cas systems and the major progress achieved in recent years in understanding the underlying mechanisms of the three stages of CRISPR-Cas immunity: adaptation, crRNA biogenesis, and interference. The ecology and regulation of CRISPR-Cas in the context of phage infection, the roles of these systems beyond immunity, and the open questions that propel the field forward are also discussed.;08/03/2018;05/08/2024 15:34;05/08/2024 15:34;;1239-1259;;6;172;;Cell;The Biology of CRISPR-Cas;;;;;;;eng;;;;;PubMed;
