Key;Item Type;Publication Year;Author;Title;Publication Title;ISBN;ISSN;DOI;Url;Abstract Note;Date;Date Added;Date Modified;Access Date;Pages;Num Pages;Issue;Volume;Number Of Volumes;Journal Abbreviation;Short Title;Series;Series Number;Series Text;Series Title;Publisher;Place;Language;Rights;Type;Archive;Archive Location;Library Catalog;Call Number
LHH9U6IX;journalArticle;2022;"Leavitt, Azita; Yirmiya, Erez; Amitai, Gil; Lu, Allen; Garb, Jeremy; Herbst, Ehud; Morehouse, Benjamin R.; Hobbs, Samuel J.; Antine, Sadie P.; Sun, Zhen-Yu J.; Kranzusch, Philip J.; Sorek, Rotem";Viruses inhibit TIR gcADPR signalling to overcome bacterial defence;Nature;;1476-4687;10.1038/s41586-022-05375-9;https://www.nature.com/articles/s41586-022-05375-9;The Toll/interleukin-1 receptor (TIR) domain is a key component of immune receptors that identify pathogen invasion in bacteria, plants and animals1–3. In the bacterial antiphage system Thoeris, as well as in plants, recognition of infection stimulates TIR domains to produce an immune signalling molecule whose molecular structure remains elusive. This molecule binds and activates the Thoeris immune effector, which then executes the immune function1. We identified a large family of phage-encoded proteins, denoted here as Thoeris anti-defence 1 (Tad1), that inhibit Thoeris immunity. We found that Tad1 proteins are ‘sponges’ that bind and sequester the immune signalling molecule produced by TIR-domain proteins, thus decoupling phage sensing from immune effector activation and rendering Thoeris inactive. Tad1 can also efficiently sequester molecules derived from a plant TIR-domain protein, and a high-resolution crystal structure of Tad1 bound to a plant-derived molecule showed a unique chemical structure of 1 ′′–2′ glycocyclic ADPR (gcADPR). Our data furthermore suggest that Thoeris TIR proteins produce a closely related molecule, 1′′–3′ gcADPR, which activates ThsA an order of magnitude more efficiently than the plant-derived 1′′–2′ gcADPR. Our results define the chemical structure of a central immune signalling molecule and show a new mode of action by which pathogens can suppress host immunity.;2022-11;05/08/2024 15:27;05/08/2024 15:27;05/08/2024 15:27;326-331;;7935;611;;;;;;;;;;en;2022 The Author(s), under exclusive licence to Springer Nature Limited;;;;www.nature.com;
VZ9MWKLQ;journalArticle;2022;"Hobbs, Samuel J.; Wein, Tanita; Lu, Allen; Morehouse, Benjamin R.; Schnabel, Julia; Leavitt, Azita; Yirmiya, Erez; Sorek, Rotem; Kranzusch, Philip J.";Phage anti-CBASS and anti-Pycsar nucleases subvert bacterial immunity;Nature;;1476-4687;10.1038/s41586-022-04716-y;https://www.nature.com/articles/s41586-022-04716-y;The cyclic oligonucleotide-based antiphage signalling system (CBASS) and the pyrimidine cyclase system for antiphage resistance (Pycsar) are antiphage defence systems in diverse bacteria that use cyclic nucleotide signals to induce cell death and prevent viral propagation1,2. Phages use several strategies to defeat host CRISPR and restriction-modification systems3–10, but no mechanisms are known to evade CBASS and Pycsar immunity. Here we show that phages encode anti-CBASS (Acb) and anti-Pycsar (Apyc) proteins that counteract defence by specifically degrading cyclic nucleotide signals that activate host immunity. Using a biochemical screen of 57 phages in Escherichia coli and Bacillus subtilis, we discover Acb1 from phage T4 and Apyc1 from phage SBSphiJ as founding members of distinct families of immune evasion proteins. Crystal structures of Acb1 in complex with 3′3′-cyclic GMP–AMP define a mechanism of metal-independent hydrolysis 3′ of adenosine bases, enabling broad recognition and degradation of cyclic dinucleotide and trinucleotide CBASS signals. Structures of Apyc1 reveal a metal-dependent cyclic NMP phosphodiesterase that uses relaxed specificity to target Pycsar cyclic pyrimidine mononucleotide signals. We show that Acb1 and Apyc1 block downstream effector activation and protect from CBASS and Pycsar defence in vivo. Active Acb1 and Apyc1 enzymes are conserved in phylogenetically diverse phages, demonstrating that cleavage of host cyclic nucleotide signals is a key strategy of immune evasion in phage biology.;2022-05;05/08/2024 15:27;05/08/2024 15:27;05/08/2024 15:27;522-526;;7910;605;;;;;;;;;;en;2022 The Author(s);;;;www.nature.com;
HIQGH7FU;journalArticle;2023;"Huiting, Erin; Cao, Xueli; Ren, Jie; Athukoralage, Januka S.; Luo, Zhaorong; Silas, Sukrit; An, Na; Carion, Héloïse; Zhou, Yu; Fraser, James S.; Feng, Yue; Bondy-Denomy, Joseph";Bacteriophages inhibit and evade cGAS-like immune function in bacteria;Cell;;1097-4172;10.1016/j.cell.2022.12.041;;"A fundamental strategy of eukaryotic antiviral immunity involves the cGAS enzyme, which synthesizes 2',3'-cGAMP and activates the effector STING. Diverse bacteria contain cGAS-like enzymes that produce cyclic oligonucleotides and induce anti-phage activity, known as CBASS. However, this activity has only been demonstrated through heterologous expression. Whether bacteria harboring CBASS antagonize and co-evolve with phages is unknown. Here, we identified an endogenous cGAS-like enzyme in Pseudomonas aeruginosa that generates 3',3'-cGAMP during phage infection, signals to a phospholipase effector, and limits phage replication. In response, phages express an anti-CBASS protein (""Acb2"") that forms a hexamer with three 3',3'-cGAMP molecules and reduces phospholipase activity. Acb2 also binds to molecules produced by other bacterial cGAS-like enzymes (3',3'-cUU/UA/UG/AA) and mammalian cGAS (2',3'-cGAMP), suggesting broad inhibition of cGAS-based immunity. Upon Acb2 deletion, CBASS blocks lytic phage replication and lysogenic induction, but rare phages evade CBASS through major capsid gene mutations. Altogether, we demonstrate endogenous CBASS anti-phage function and strategies of CBASS inhibition and evasion.";16/02/2023;05/08/2024 15:28;05/08/2024 15:28;;864-876.e21;;4;186;;Cell;;;;;;;;eng;;;;;PubMed;
TYM22PUF;journalArticle;2023;"Cao, Xueli; Xiao, Yu; Huiting, Erin; Cao, Xujun; Li, Dong; Ren, Jie; Guan, Linlin; Wang, Yu; Li, Lingyin; Bondy-Denomy, Joseph; Feng, Yue";Phage anti-CBASS protein simultaneously sequesters cyclic trinucleotides and dinucleotides;bioRxiv;;;10.1101/2023.06.01.543220;https://www.ncbi.nlm.nih.gov/pmc/articles/PMC10312549/;CBASS is a common anti-phage immune system that uses cyclic oligonucleotide signals to activate effectors and limit phage replication. In turn, phages encode anti-CBASS (Acb) proteins. We recently uncovered a widespread phage anti-CBASS protein Acb2 that acts as a “sponge” by forming a hexamer complex with three cGAMP molecules. Here, we identified that Acb2 binds and sequesters many CBASS and cGAS-produced cyclic dinucleotides in vitro and inhibits cGAMP-mediated STING activity in human cells. Surprisingly, Acb2 also binds CBASS cyclic trinucleotides 3’3’3’-cyclic AMP-AMP-AMP (cA3) and 3’3’3’-cAAG with high affinity. Structural characterization identified a distinct binding pocket within the Acb2 hexamer that binds two cyclic trinucleotide molecules and another binding pocket that binds to cyclic dinucleotides. Binding in one pocket does not allosterically alter the other, such that one Acb2 hexamer can simultaneously bind two cyclic trinucleotides and three cyclic dinucleotides. Phage-encoded Acb2 provides protection from Type III-C CBASS that uses cA3 signaling molecules in vivo and blocks cA3-mediated activation of the endonuclease effector in vitro. Altogether, Acb2 sequesters nearly all known CBASS signaling molecules through two distinct binding pockets and therefore serves as a broad-spectrum inhibitor of cGAS-based immunity.;01/06/2023;05/08/2024 15:28;05/08/2024 15:28;05/08/2024 15:28;2023.06.01.543220;;;;;bioRxiv;;;;;;;;;;;;;PubMed Central;
7QV8RJB3;preprint;2023;"Li, Dong; Xiao, Yu; Xiong, Weijia; Fedorova, Iana; Wang, Yu; Liu, Xi; Huiting, Erin; Ren, Jie; Gao, Zirui; Zhao, Xingyu; Cao, Xueli; Zhang, Yi; Bondy-Denomy, Joseph; Feng, Yue";Single phage proteins sequester TIR- and cGAS-generated signaling molecules;;;;10.1101/2023.11.15.567273;https://www.biorxiv.org/content/10.1101/2023.11.15.567273v1;Prokaryotic anti-phage immune systems use TIR (toll/interleukin-1 receptor) and cGAS (cyclic GMP-AMP synthase) enzymes to produce 1’’-3’/1’’-2’ glycocyclic ADPR (gcADPR) and cyclid di-/tri-nucleotides (CDNs and CTNs) signaling molecules that limit phage replication, respectively 1–3. However, how phages neutralize these common systems is largely unknown. Here, we show that Thoeris anti-defense proteins Tad1 4 and Tad2 5 both have anti-CBASS activity by simultaneously sequestering CBASS cyclic oligonucleotides. Strikingly, apart from binding Thoeris signals 1’’-3’ and 1’’-2’ gcADPR, Tad1 also binds numerous CBASS CDNs/CTNs with high affinity, inhibiting CBASS systems using these molecules in vivo and in vitro. The hexameric Tad1 has six binding sites for CDNs or gcADPR, which are independent from two high affinity binding sites for CTNs. Tad2 also sequesters various CDNs in addition to gcADPR molecules, inhibiting CBASS systems using these CDNs. However, the binding pockets for CDNs and gcADPR are different in Tad2, whereby a tetramer can bind two CDNs and two gcADPR molecules simultaneously. Taken together, Tad1 and Tad2 are both two-pronged inhibitors that, alongside anti-CBASS protein 2, establish a paradigm of phage proteins that flexibly sequester a remarkable breadth of cyclic nucleotides involved in TIR- and cGAS-based anti-phage immunity.;16/11/2023;05/08/2024 15:28;05/08/2024 15:28;05/08/2024 15:28;;;;;;;;;;;;bioRxiv;;en;© 2023, Posted by Cold Spring Harbor Laboratory. This pre-print is available under a Creative Commons License (Attribution-NonCommercial-NoDerivs 4.0 International), CC BY-NC-ND 4.0, as described at http://creativecommons.org/licenses/by-nc-nd/4.0/;;;;bioRxiv;
24B7YQXC;journalArticle;2023;"Jenson, Justin M.; Li, Tuo; Du, Fenghe; Ea, Chee-Kwee; Chen, Zhijian J.";Ubiquitin-like conjugation by bacterial cGAS enhances anti-phage defence;Nature;;1476-4687;10.1038/s41586-023-05862-7;https://www.nature.com/articles/s41586-023-05862-7;cGAS is an evolutionarily conserved enzyme that has a pivotal role in immune defence against infection1–3. In vertebrate animals, cGAS is activated by DNA to produce cyclic GMP–AMP (cGAMP)4,5, which leads to the expression of antimicrobial genes6,7. In bacteria, cyclic dinucleotide (CDN)-based anti-phage signalling systems (CBASS) have been discovered8–11. These systems are composed of cGAS-like enzymes and various effector proteins that kill bacteria on phage infection, thereby stopping phage spread. Of the CBASS systems reported, approximately 39% contain Cap2 and Cap3, which encode proteins with homology to ubiquitin conjugating (E1/E2) and deconjugating enzymes, respectively8,12. Although these proteins are required to prevent infection of some bacteriophages8, the mechanism by which the enzymatic activities exert an anti-phage effect is unknown. Here we show that Cap2 forms a thioester bond with the C-terminal glycine of cGAS and promotes conjugation of cGAS to target proteins in a process that resembles ubiquitin conjugation. The covalent conjugation of cGAS increases the production of cGAMP. Using a genetic screen, we found that the phage protein Vs.4 antagonized cGAS signalling by binding tightly to cGAMP (dissociation constant of approximately 30 nM) and sequestering it. A crystal structure of Vs.4 bound to cGAMP showed that Vs.4 formed a hexamer that was bound to three molecules of cGAMP. These results reveal a ubiquitin-like conjugation mechanism that regulates cGAS activity in bacteria and illustrates an arms race between bacteria and viruses through controlling CDN levels.;2023-04;05/08/2024 15:28;05/08/2024 15:28;05/08/2024 15:28;326-331;;7956;616;;;;;;;;;;en;2023 The Author(s);;;;www.nature.com;
2P9KSY5D;journalArticle;2023;"Ho, Peiyin; Chen, Yibu; Biswas, Subarna; Canfield, Ethan; Abdolvahabi, Alireza; Feldman, Douglas E.";Bacteriophage antidefense genes that neutralize TIR and STING immune responses;Cell Reports;;2211-1247;10.1016/j.celrep.2023.112305;;Programmed cell suicide of infected bacteria, known as abortive infection (Abi), serves as an immune defense strategy to prevent the propagation of bacteriophage viruses. Many Abi systems utilize bespoke cyclic nucleotide immune messengers generated upon infection to mobilize cognate death effectors. Here, we identify a family of bacteriophage nucleotidyltransferases (NTases) that synthesize competitor cyclic dinucleotide (CDN) ligands and inhibit TIR NADase effectors activated via a linked STING CDN sensor domain (TIR-STING). Through a functional screen of NTase-adjacent phage genes, we uncover candidate inhibitors of cell suicide induced by heterologous expression of tonically active TIR-STING. Among these, we demonstrate that a virus MazG-like nucleotide pyrophosphohydrolase, Atd1, depletes the starvation alarmone (p)ppGpp, revealing a potential role for the alarmone-activated host toxin MazF as an executioner of TIR-driven Abi. Phage NTases and counterdefenses like Atd1 preserve host viability to ensure virus propagation and represent tools to modulate TIR and STING immune responses.;25/04/2023;05/08/2024 15:28;05/08/2024 15:28;;112305;;4;42;;Cell Rep;;;;;;;;eng;;;;;PubMed;
VVUKV3DS;preprint;2024;"Osterman, Ilya; Samra, Hadar; Rousset, Francois; Loseva, Elena; Itkin, Maxim; Malitsky, Sergey; Yirmiya, Erez; Millman, Adi; Sorek, Rotem";Phages reconstitute NAD+ to counter bacterial immunity;;;;10.1101/2024.02.11.579819;https://www.biorxiv.org/content/10.1101/2024.02.11.579819v1;Bacteria defend against phage infection via a variety of antiphage defense systems. Many defense systems were recently shown to deplete cellular nicotinamide adenine dinucleotide (NAD+) in response to infection, by breaking NAD+ to ADP-ribose (ADPR) and nicotinamide. It was demonstrated that NAD+ depletion during infection deprives the phage from this essential molecule and impedes phage replication. Here we show that a substantial fraction of phages possess enzymatic pathways allowing reconstitution of NAD+ from its degradation products in infected cells. We describe NAD+ reconstitution pathway 1 (NARP1), a two-step pathway in which one enzyme phosphorylates ADPR to generate ADPR-pyrophosphate (ADPR-PP), and the second enzyme conjugates ADPR- PP and nicotinamide to generate NAD+. Phages encoding the NARP1 pathway can overcome a diverse set of defense systems, including Thoeris, DSR1, DSR2, SIR2-HerA, and SEFIR, all of which deplete NAD+ as part of their defensive mechanism. Phylogenetic analyses show that NARP1 is primarily encoded on phage genomes, suggesting a phage- specific function in countering bacterial defenses. A second pathway, NARP2, allows phages to overcome bacterial defenses by building NAD+ via metabolites different than ADPR-PP. Our findings report a unique immune evasion strategy where viruses rebuild molecules depleted by defense systems, thus overcoming host immunity.;13/02/2024;05/08/2024 15:29;05/08/2024 15:29;05/08/2024 15:29;;;;;;;;;;;;bioRxiv;;en;© 2024, Posted by Cold Spring Harbor Laboratory. This pre-print is available under a Creative Commons License (Attribution-NonCommercial-NoDerivs 4.0 International), CC BY-NC-ND 4.0, as described at http://creativecommons.org/licenses/by-nc-nd/4.0/;;;;bioRxiv;
6SW3TRMI;journalArticle;2013;"Bondy-Denomy, Joe; Pawluk, April; Maxwell, Karen L.; Davidson, Alan R.";Bacteriophage genes that inactivate the CRISPR/Cas bacterial immune system;Nature;;1476-4687;10.1038/nature11723;https://www.nature.com/articles/nature11723;Five classes of phage genes are identified that protect phages from CRISPR-mediated bacterial immunity.;2013-01;05/08/2024 15:29;05/08/2024 15:29;05/08/2024 15:29;429-432;;7432;493;;;;;;;;;;en;2012 Springer Nature Limited;;;;www.nature.com;
CPSX4N9K;journalArticle;2020;"Pinilla-Redondo, Rafael; Shehreen, Saadlee; Marino, Nicole D.; Fagerlund, Robert D.; Brown, Chris M.; Sørensen, Søren J.; Fineran, Peter C.; Bondy-Denomy, Joseph";Discovery of multiple anti-CRISPRs highlights anti-defense gene clustering in mobile genetic elements;Nature Communications;;2041-1723;10.1038/s41467-020-19415-3;https://www.nature.com/articles/s41467-020-19415-3;"Many prokaryotes employ CRISPR–Cas systems to combat invading mobile genetic elements (MGEs). In response, some MGEs have developed strategies to bypass immunity, including anti-CRISPR (Acr) proteins; yet the diversity, distribution and spectrum of activity of this immune evasion strategy remain largely unknown. Here, we report the discovery of new Acrs by assaying candidate genes adjacent to a conserved Acr-associated (Aca) gene, aca5, against a panel of six type I systems: I–F (Pseudomonas, Pectobacterium, and Serratia), I–E (Pseudomonas and Serratia), and I–C (Pseudomonas). We uncover 11 type I–F and/or I–E anti-CRISPR genes encoded on chromosomal and extrachromosomal MGEs within Enterobacteriaceae and Pseudomonas, and an additional Aca (aca9). The acr genes not only associate with other acr genes, but also with genes encoding inhibitors of distinct bacterial defense systems. Thus, our findings highlight the potential exploitation of acr loci neighborhoods for the identification of previously undescribed anti-defense systems.";06/11/2020;05/08/2024 15:29;05/08/2024 15:29;05/08/2024 15:29;5652;;1;11;;Nat Commun;;;;;;;;en;2020 The Author(s);;;;www.nature.com;
8DDTKDDP;preprint;2023;"Samuel, Bruria; Burstein, David";A diverse repertoire of anti-defense systems is encoded in the leading region of plasmids;;;;10.1101/2023.02.15.528439;https://www.biorxiv.org/content/10.1101/2023.02.15.528439v1;Plasmids are an important source of antibiotic-resistance genes that mobilize horizontally between bacteria, including many human pathogens. Bacteria express various defense mechanisms, such as CRISPR-Cas, restriction-modification systems, and SOS-response genes, to prevent the invasion of mobile elements. Yet, plasmids efficiently and robustly overcome these defenses during conjugation. Here, we show that the leading region of plasmids, which is the first to enter recipient cells, is a hotspot for an extensive repertoire of anti-defense systems, encoding anti-CRISPR, anti-restriction, anti-SOS, and other counter-defense proteins. We further demonstrate that focusing on these specific functional regions can lead to the discovery of diverse anti-defense genes. Promoters known to allow expression from ssDNA were prevalent in the leading regions, potentially facilitating rapid protection against bacterial immunity in the early stages of plasmid invasion. These findings reveal a new facet of plasmid dissemination and provide theoretical foundations for developing conjugative delivery systems for natural microbial communities.;16/02/2023;05/08/2024 15:29;05/08/2024 15:29;05/08/2024 15:29;;;;;;;;;;;;bioRxiv;;en;© 2023, Posted by Cold Spring Harbor Laboratory. This pre-print is available under a Creative Commons License (Attribution-NonCommercial 4.0 International), CC BY-NC 4.0, as described at http://creativecommons.org/licenses/by-nc/4.0/;;;;bioRxiv;
LVE7E5AP;journalArticle;2020;"Athukoralage, Januka S.; McMahon, Stephen A.; Zhang, Changyi; Grüschow, Sabine; Graham, Shirley; Krupovic, Mart; Whitaker, Rachel J.; Gloster, Tracey M.; White, Malcolm F.";An anti-CRISPR viral ring nuclease subverts type III CRISPR immunity;Nature;;1476-4687;10.1038/s41586-019-1909-5;https://www.nature.com/articles/s41586-019-1909-5;The CRISPR system in bacteria and archaea provides adaptive immunity against mobile genetic elements. Type III CRISPR systems detect viral RNA, resulting in the activation of two regions of the Cas10 protein: an HD nuclease domain (which degrades viral DNA)1,2 and a cyclase domain (which synthesizes cyclic oligoadenylates from ATP)3–5. Cyclic oligoadenylates in turn activate defence enzymes with a CRISPR-associated Rossmann fold domain6, sculpting a powerful antiviral response7–10 that can drive viruses to extinction7,8. Cyclic nucleotides are increasingly implicated in host–pathogen interactions11–13. Here we identify a new family of viral anti-CRISPR (Acr) enzymes that rapidly degrade cyclic tetra-adenylate (cA4). The viral ring nuclease AcrIII-1 is widely distributed in archaeal and bacterial viruses and in proviruses. The enzyme uses a previously unknown fold to bind cA4 specifically, and a conserved active site to rapidly cleave this signalling molecule, allowing viruses to neutralize the type III CRISPR defence system. The AcrIII-1 family has a broad host range, as it targets cA4 signalling molecules rather than specific CRISPR effector proteins. Our findings highlight the crucial role of cyclic nucleotide signalling in the conflict between viruses and their hosts.;2020-01;05/08/2024 15:30;05/08/2024 15:30;05/08/2024 15:30;572-575;;7791;577;;;;;;;;;;en;2020 The Author(s), under exclusive licence to Springer Nature Limited;;;;www.nature.com;
MDZLEFCY;journalArticle;2020;"Samolygo, Aleksei; Athukoralage, Januka S; Graham, Shirley; White, Malcolm F";Fuse to defuse: a self-limiting ribonuclease-ring nuclease fusion for type III CRISPR defence;Nucleic Acids Research;;0305-1048;10.1093/nar/gkaa298;https://doi.org/10.1093/nar/gkaa298;Type III CRISPR systems synthesise cyclic oligoadenylate (cOA) second messengers in response to viral infection of bacteria and archaea, potentiating an immune response by binding and activating ancillary effector nucleases such as Csx1. As these effectors are not specific for invading nucleic acids, a prolonged activation can result in cell dormancy or death. Some archaeal species encode a specialised ring nuclease enzyme (Crn1) to degrade cyclic tetra-adenylate (cA4) and deactivate the ancillary nucleases. Some archaeal viruses and bacteriophage encode a potent ring nuclease anti-CRISPR, AcrIII-1, to rapidly degrade cA4 and neutralise immunity. Homologues of this enzyme (named Crn2) exist in type III CRISPR systems but are uncharacterised. Here we describe an unusual fusion between cA4-activated CRISPR ribonuclease (Csx1) and a cA4-degrading ring nuclease (Crn2) from Marinitoga piezophila. The protein has two binding sites that compete for the cA4 ligand, a canonical cA4-activated ribonuclease activity in the Csx1 domain and a potent cA4 ring nuclease activity in the C-terminal Crn2 domain. The cA4 binding affinities and activities of the two constituent enzymes in the fusion protein may have evolved to ensure a robust but time-limited cOA-activated ribonuclease activity that is finely tuned to cA4 levels as a second messenger of infection.;19/06/2020;05/08/2024 15:30;05/08/2024 15:30;05/08/2024 15:30;6149-6156;;11;48;;Nucleic Acids Research;Fuse to defuse;;;;;;;;;;;;Silverchair;
6JZHBDCJ;journalArticle;2022;"Tesson, Florian; Hervé, Alexandre; Mordret, Ernest; Touchon, Marie; d’Humières, Camille; Cury, Jean; Bernheim, Aude";Systematic and quantitative view of the antiviral arsenal of prokaryotes;Nature Communications;;2041-1723;10.1038/s41467-022-30269-9;https://www.nature.com/articles/s41467-022-30269-9;Bacteria and archaea have developed multiple antiviral mechanisms, and genomic evidence indicates that several of these antiviral systems co-occur in the same strain. Here, we introduce DefenseFinder, a tool that automatically detects known antiviral systems in prokaryotic genomes. We use DefenseFinder to analyse 21000 fully sequenced prokaryotic genomes, and find that antiviral strategies vary drastically between phyla, species and strains. Variations in composition of antiviral systems correlate with genome size, viral threat, and lifestyle traits. DefenseFinder will facilitate large-scale genomic analysis of antiviral defense systems and the study of host-virus interactions in prokaryotes.;10/05/2022;05/08/2024 15:30;05/08/2024 15:30;05/08/2024 15:30;2561;;1;13;;Nat Commun;;;;;;;;en;2022 The Author(s);;;;www.nature.com;
QIKTK344;journalArticle;2023;"Néron, Bertrand; Denise, Rémi; Coluzzi, Charles; Touchon, Marie; Rocha, Eduardo P. C.; Abby, Sophie S.";MacSyFinder v2: Improved modelling and search engine to identify molecular systems in genomes;Peer Community Journal;;2804-3871;10.24072/pcjournal.250;https://peercommunityjournal.org/articles/10.24072/pcjournal.250/;;2023;05/08/2024 15:30;05/08/2024 15:30;05/08/2024 15:30;;;;3;;;MacSyFinder v2;;;;;;;fr;;;;;peercommunityjournal.org;
